v1,v2
spam,"Today's Offer! Claim ur å£150 worth of discount vouchers! Text YES to 85023 now! SavaMob, member offers mobile! T Cs 08717898035. å£3.00 Sub. 16 . Unsub reply X"
spam,Buy Space Invaders 4 a chance 2 win orig Arcade Game console. Press 0 for Games Arcade (std WAP charge) See o2.co.uk/games 4 Terms + settings. No purchase
spam,Refused a loan? Secured or Unsecured? Can't get credit? Call free now 0800 195 6669 or text back 'help' & we will!
spam,"Fantasy Football is back on your TV. Go to Sky Gamestar on Sky Active and play å£250k Dream Team. Scoring starts on Saturday, so register now!SKY OPT OUT to 88088"
ham,Where is it. Is there any opening for mca.
spam,"FREE RING TONE just text \POLYS\"""" to 87131. Then every week get a new tone. 0870737910216yrs only å£1.50/wk."""""
ham,Asking do u knw them or nt? May be ur frnds or classmates?
spam,"URGENT! Your mobile was awarded a å£1,500 Bonus Caller Prize on 27/6/03. Our final attempt 2 contact U! Call 08714714011"
spam,"URGENT. Important information for 02 user. Today is your lucky day! 2 find out why , log onto http://www.urawinner.com there is a fantastic surprise awaiting you !"
spam,FreeMsg:Feelin kinda lnly hope u like 2 keep me company! Jst got a cam moby wanna c my pic?Txt or reply DATE to 82242 Msg150p 2rcv Hlp 08712317606 stop to 82242
spam,Collect your VALENTINE'S weekend to PARIS inc Flight & Hotel + å£200 Prize guaranteed! Text: PARIS to No: 69101. www.rtf.sphosting.com
ham,haha but no money leh... Later got to go for tuition... Haha and looking for empty slots for driving lessons
ham,I dunno lei... Like dun haf...
spam,"Customer service announcement. We recently tried to make a delivery to you but were unable to do so, please call 07099833605 to re-schedule. Ref:9280114"
spam,todays vodafone numbers ending with 0089(my last four digits) are selected to received a å£350 award. If your number matches please call 09063442151 to claim your å£350 award
ham,"Aight no rush, I'll ask jay"
spam,"accordingly. I repeat, just text the word ok on your mobile phone and send"
spam,"Congrats! 1 year special cinema pass for 2 is yours. call 09061209465 now! C Suprman V, Matrix3, StarWars3, etc all 4 FREE! bx420-ip4-5we. 150pm. Dont miss out! "
ham,Not thought bout it... || Drink in tap & spile at seven. || Is that pub on gas st off broad st by canal. || Ok?
spam,"U were outbid by simonwatson5120 on the Shinco DVD Plyr. 2 bid again, visit sms. ac/smsrewards 2 end bid notifications, reply END OUT"
spam,Bought one ringtone and now getting texts costing 3 pound offering more tones etc
spam,Your weekly Cool-Mob tones are ready to download !This weeks new Tones include: 1) Crazy Frog-AXEL F>>> 2) Akon-Lonely>>> 3) Black Eyed-Dont P >>>More info in n
ham,Anything lor. Juz both of us lor.
ham,Sounds like you have many talents! would you like to go on a dinner date next week?
ham,Hey anyway i have to :-)
spam,Want 2 get laid tonight? Want real Dogging locations sent direct 2 ur mob? Join the UK's largest Dogging Network bt Txting GRAVEL to 69888! Nt. ec2a. 31p.msg@150p
spam,"Text82228>> Get more ringtones, logos and games from www.txt82228.com. Questions: info@txt82228.co.uk"
spam,"Double mins and txts 4 6months FREE Bluetooth on Orange. Available on Sony, Nokia Motorola phones. Call MobileUpd8 on 08000839402 or call2optout/N9DX"
spam,Sunshine Quiz Wkly Q! Win a top Sony DVD player if u know which country the Algarve is in? Txt ansr to 82277. å£1.50 SP:Tyrone
spam,Bored housewives! Chat n date now! 0871750.77.11! BT-national rate 10p/min only from landlines!
spam,Hi I'm sue. I am 20 years old and work as a lapdancer. I love sex. Text me live - I'm i my bedroom now. text SUE to 89555. By TextOperator G2 1DA 150ppmsg 18+
ham,"The table's occupied, I'm waiting by the tree"
ham,Come by our room at some point so we can iron out the plan for this weekend
ham,Yup Ì_ not comin :-(
ham,From here after The performance award is calculated every two month.not for current one month period..
ham,"It's wylie, you in tampa or sarasota?"
ham,Actually I decided I was too hungry so I haven't left yet :V
ham,Yetunde i'm in class can you not run water on it to make it ok. Pls now.
ham,Neshanth..tel me who r u?
spam,U have a secret admirer who is looking 2 make contact with U-find out who they R*reveal who thinks UR so special-call on 09058094599
ham,"Nah, I'm a perpetual DD"
spam,"Urgent -call 09066649731from Landline. Your complimentary 4* Ibiza Holiday or å£10,000 cash await collection SAE T&Cs PO BOX 434 SK3 8WP 150ppm 18+"
spam,u r a winner U ave been specially selected 2 receive å£1000 cash or a 4* holiday (flights inc) speak to a live operator 2 claim 0871277810710p/min (18 )
ham,Kay... Since we are out already
ham,There generally isn't one. It's an uncountable noun - u in the dictionary. pieces of research?
ham,That's good. Lets thank God. Please complete the drug. Have lots of water. And have a beautiful day.
spam,"\For the most sparkling shopping breaks from 45 per person; call 0121 2025050 or visit www.shortbreaks.org.uk\"""""""""
spam,RGENT! This is the 2nd attempt to contact U!U have WON å£1250 CALL 09071512433 b4 050703 T&CsBCM4235WC1N3XX. callcost 150ppm mobilesvary. maxå£7. 50
spam,"You are guaranteed the latest Nokia Phone, a 40GB iPod MP3 player or a å£500 prize! Txt word: COLLECT to No: 83355! IBHltd LdnW15H 150p/Mtmsgrcvd18"
spam,Want the latest Video handset? 750 anytime any network mins? Half price line rental? Reply or call 08000930705 for delivery tomorrow
spam,You have an important customer service announcement. Call FREEPHONE 0800 542 0825 now!
spam,You have 1 new voicemail. Please call 08719181513.
ham,I'm not driving... Raining! Then i'll get caught at e mrt station lor.
spam,"Dear Voucher Holder, To claim this weeks offer, at you PC please go to http://www.e-tlp.co.uk/reward. Ts&Cs apply."
spam,"LookAtMe!: Thanks for your purchase of a video clip from LookAtMe!, you've been charged 35p. Think you can do better? Why not send a video in a MMSto 32323."
ham,K... Must book a not huh? so going for yoga basic on sunday?
ham,"The sign of maturity is not when we start saying big things.. But actually it is, when we start understanding small things... *HAVE A NICE EVENING* BSLVYL"
ham,Otherwise had part time job na-tuition..
spam,(Bank of Granite issues Strong-Buy) EXPLOSIVE PICK FOR OUR MEMBERS *****UP OVER 300% *********** Nasdaq Symbol CDGT That is a $5.00 per..
spam,Great NEW Offer - DOUBLE Mins & DOUBLE Txt on best Orange tariffs AND get latest camera phones 4 FREE! Call MobileUpd8 free on 08000839402 NOW! or 2stoptxt T&Cs
spam,PRIVATE! Your 2003 Account Statement for shows 800 un-redeemed S. I. M. points. Call 08715203694 Identifier Code: 40533 Expires 31/10/04
ham,* Thought I didn't see you.
ham,I'm leaving my house now.
spam,sexy sexy cum and text me im wet and warm and ready for some porn! u up for some fun? THIS MSG IS FREE RECD MSGS 150P INC VAT 2 CANCEL TEXT STOP
spam,CLAIRE here am havin borin time & am now alone U wanna cum over 2nite? Chat now 09099725823 hope 2 C U Luv CLAIRE xx Callså£1/minmoremobsEMSPOBox45PO139WA
spam,"Sppok up ur mob with a Halloween collection of nokia logo&pic message plus a FREE eerie tone, txt CARD SPOOK to 8007"
ham,I dont have any of your file in my bag..i was in work when you called me.i 'll tell you if i find anything in my room.
spam,"Urgent! call 09066612661 from landline. Your complementary 4* Tenerife Holiday or å£10,000 cash await collection SAE T&Cs PO Box 3 WA14 2PX 150ppm 18+ Sender: Hol Offer"
ham,"Hiya, sorry didn't hav signal. I haven't seen or heard from and neither has, which is unusual in itself! I'll put on the case and get him to sort it out! Hugs and snogs."
spam,"44 7732584351, Do you want a New Nokia 3510i colour phone DeliveredTomorrow? With 300 free minutes to any mobile + 100 free texts + Free Camcorder reply or call 08000930705."
ham,When are you going to ride your bike?
ham,S.this will increase the chance of winning.
ham,Yes. It's all innocent fun. O:-)
ham,Hiya. How was last night? I've been naughty and bought myself clothes and very little ... Ready for more shopping tho! What kind of time do you wanna meet?
spam,URGENT! We are trying to contact you. Last weekends draw shows that you have won a å£900 prize GUARANTEED. Call 09061701851. Claim code K61. Valid 12hours only
ham,I'm working technical support :)voice process.
spam,CALL 09090900040 & LISTEN TO EXTREME DIRTY LIVE CHAT GOING ON IN THE OFFICE RIGHT NOW TOTAL PRIVACY NO ONE KNOWS YOUR [sic] LISTENING 60P MIN 24/7MP 0870753331018+
ham,Been running but only managed 5 minutes and then needed oxygen! Might have to resort to the roller option!
spam,WIN a year supply of CDs 4 a store of ur choice worth å£500 & enter our å£100 Weekly draw txt MUSIC to 87066 Ts&Cs www.Ldew.com.subs16+1win150ppmx3
spam,SMS. ac sun0819 posts HELLO:\You seem cool
ham,"Yar lor he wan 2 go c horse racing today mah, so eat earlier lor. I ate chicken rice. U?"
spam,FREE entry into our å£250 weekly comp just send the word ENTER to 84128 NOW. 18 T&C www.textcomp.com cust care 08712405020.
spam,"TheMob> Check out our newest selection of content, Games, Tones, Gossip, babes and sport, Keep your mobile fit and funky text WAP to 82468"
ham,Congrats. That's great. I wanted to tell you not to tell me your score cos it might make me relax. But its motivating me so thanks for sharing
ham,"Sorry, I'll call later"
spam,U‰Ûªve Bin Awarded å£50 to Play 4 Instant Cash. Call 08715203028 To Claim. EVERY 9th Player Wins Min å£50-å£500. OptOut 08718727870
ham,Eh sorry leh... I din c ur msg. Not sad already lar. Me watching tv now. U still in office?
ham,"Dear Sir,Salam Alaikkum.Pride and Pleasure meeting you today at the Tea Shop.We are pleased to send you our contact number at Qatar.Rakhesh an Indian.Pls save our Number.Respectful Regards."
spam,"pdate_Now - Double mins and 1000 txts on Orange tariffs. Latest Motorola, SonyEricsson & Nokia & Bluetooth FREE! Call MobileUpd8 on 08000839402 or call2optout/!YHL"
spam,"Dear Voucher Holder, 2 claim this weeks offer, at your PC go to http://www.e-tlp.co.uk/expressoffer Ts&Cs apply.2 stop texts txt STOP to 80062."
ham,All e best 4 ur exam later.
ham,"It'll be tough, but I'll do what I have to"
spam,Free Top ringtone -sub to weekly ringtone-get 1st week free-send SUBPOLY to 81618-?3 per week-stop sms-08718727870
spam,Congratulations ur awarded either å£500 of CD gift vouchers & Free entry 2 our å£100 weekly draw txt MUSIC to 87066 TnCs www.Ldew.com1win150ppmx3age16
spam,+449071512431 URGENT! This is the 2nd attempt to contact U!U have WON å£1250 CALL 09071512433 b4 050703 T&CsBCM4235WC1N3XX. callcost 150ppm mobilesvary. maxå£7. 50
spam,Congratulations ur awarded either å£500 of CD gift vouchers & Free entry 2 our å£100 weekly draw txt MUSIC to 87066 TnCs www.Ldew.com 1 win150ppmx3age16
ham,"A few people are at the game, I'm at the mall with iouri and kaila"
ham,Mm umma ask vava also to come tell him can play later together
ham,Am not working but am up to eyes in philosophy so will text u later when a bit more free for chat...
ham,At 4. Let's go to bill millers
spam,URGENT! Your Mobile number has been awarded with a å£2000 prize GUARANTEED. Call 09061790121 from land line. Claim 3030. Valid 12hrs only 150ppm
spam,You have WON a guaranteed å£1000 cash or a å£2000 prize. To claim yr prize call our customer service representative on 08714712412 between 10am-7pm Cost 10p
spam,"URGENT! Your mobile number *************** WON a å£2000 Bonus Caller prize on 10/06/03! This is the 2nd attempt to reach you! Call 09066368753 ASAP! Box 97N7QP, 150ppm"
spam,We tried to contact you re your reply to our offer of 750 mins 150 textand a new video phone call 08002988890 now or reply for free delivery tomorrow
spam,"Customer service announcement. We recently tried to make a delivery to you but were unable to do so, please call 07090298926 to re-schedule. Ref:9307622"
spam,How about getting in touch with folks waiting for company? Just txt back your NAME and AGE to opt in! Enjoy the community (150p/SMS)
ham,"Garbage bags, eggs, jam, bread, hannaford wheat chex"
ham,Sorry de i went to shop.
spam,Block Breaker now comes in deluxe format with new features and great graphics from T-Mobile. Buy for just å£5 by replying GET BBDELUXE and take the challenge
spam,Jamster! To get your free wallpaper text HEART to 88888 now! T&C apply. 16 only. Need Help? Call 08701213186.
spam,Great NEW Offer - DOUBLE Mins & DOUBLE Txt on best Orange tariffs AND get latest camera phones 4 FREE! Call MobileUpd8 free on 08000839402 NOW! or 2stoptxt T&Cs
ham,(You didn't hear it from me)
ham,I might go 2 sch. Yar at e salon now v boring.
ham,That's ok. I popped in to ask bout something and she said you'd been in. Are you around tonght wen this girl comes?
spam,U have a secret admirer who is looking 2 make contact with U-find out who they R*reveal who thinks UR so special-call on 09058094565
ham,I want to be inside you every night...
spam,Gr8 new service - live sex video chat on your mob - see the sexiest dirtiest girls live on ur phone - 4 details text horny to 89070 to cancel send STOP to 89070
ham,Good evening! this is roger. How are you?
ham,Lol please do. Actually send a pic of yourself right now. I wanna see. Pose with a comb and hair dryer or something.
spam,Reply to win å£100 weekly! Where will the 2006 FIFA World Cup be held? Send STOP to 87239 to end service
spam,goldviking (29/M) is inviting you to be his friend. Reply YES-762 or NO-762 See him: www.SMS.ac/u/goldviking STOP? Send STOP FRND to 62468
spam,"WIN: We have a winner! Mr. T. Foley won an iPod! More exciting prizes soon, so keep an eye on ur mobile or visit www.win-82050.co.uk"
ham,Ya! when are Ì_ taking ure practical lessons? I start in june..
ham,"If you're still up, maybe leave the credit card so I can get gas when I get back like he told me to"
ham,Yes... I trust u to buy new stuff ASAP so I can try it out
ham,But i'll b going 2 sch on mon. My sis need 2 take smth.
ham,So what about you. What do you remember
ham,It has issues right now. Ill fix for her by tomorrow.
spam,"YOUR CHANCE TO BE ON A REALITY FANTASY SHOW call now = 08707509020 Just 20p per min NTT Ltd, PO Box 1327 Croydon CR9 5WB 0870 is a national = rate call."
spam,"Hack Chat. Get backdoor entry into 121 chat rooms at a fraction of the cost. Reply NEO69 or call 09050280520, to subscribe 25p pm. DPS, Bcm box 8027 Ldn, wc1n3xx"
spam,Camera - You are awarded a SiPix Digital Camera! call 09061221066 fromm landline. Delivery within 28 days.
ham,"Hello, yeah i've just got out of the bath and need to do my hair so i'll come up when i'm done, yeah?"
ham,Thats cool. i am a gentleman and will treat you with dignity and respect.
spam,You have WON a guaranteed å£1000 cash or a å£2000 prize.To claim yr prize call our customer service representative on
ham,What's your room number again? Wanna make sure I'm knocking on the right door
spam,This message is free. Welcome to the new & improved Sex & Dogging club! To unsubscribe from this service reply STOP. msgs@150p 18 only
ham,I was about to do it when i texted. I finished a long time ago and showered and er'ything!
ham,What is important is that you prevent dehydration by giving her enough fluids
ham,No rushing. I'm not working. I'm in school so if we rush we go hungry.
ham,I'm now but have to wait till 2 for the bus to pick me.
spam,XCLUSIVE@CLUBSAISAI 2MOROW 28/5 SOIREE SPECIALE ZOUK WITH NICHOLS FROM PARIS.FREE ROSES 2 ALL LADIES !!! info: 07946746291/07880867867
ham,Pls clarify back if an open return ticket that i have can be preponed for me to go back to kerala.
spam,YOU ARE CHOSEN TO RECEIVE A å£350 AWARD! Pls call claim number 09066364311 to collect your award which you are selected to receive as a valued mobile customer.
ham,We not leaving yet. Ok lor then we go elsewhere n eat. U thk...
spam,PRIVATE! Your 2003 Account Statement for shows 800 un-redeemed S. I. M. points. Call 08718738002 Identifier Code: 48922 Expires 21/11/04
ham,So u wan 2 come for our dinner tonight a not?
ham,Msgs r not time pass.They silently say that I am thinking of U right now and also making U think of me at least 4 a moment. Gd nt.swt drms @Shesil
spam,"SMS. ac Blind Date 4U!: Rodds1 is 21/m from Aberdeen, United Kingdom. Check Him out http://img. sms. ac/W/icmb3cktz8r7!-4 no Blind Dates send HIDE"
spam,ree entry in 2 a weekly comp for a chance to win an ipod. Txt POD to 80182 to get entry (std txt rate) T&C's apply 08452810073 for details 18+
spam,Free video camera phones with Half Price line rental for 12 mths and 500 cross ntwk mins 100 txts. Call MobileUpd8 08001950382 or Call2OptOut/674&
spam,We tried to contact you re your reply to our offer of a Video Handset? 750 anytime networks mins? UNLIMITED TEXT? Camcorder? Reply or call 08000930705 NOW
spam,Knock Knock Txt whose there to 80082 to enter r weekly draw 4 a å£250 gift voucher 4 a store of yr choice. T&Cs www.tkls.com age16 to stoptxtstopå£1.50/week
ham,Mm i am on the way to railway
spam,"Someone U know has asked our dating service 2 contact you! Cant Guess who? CALL 09058097189 NOW all will be revealed. POBox 6, LS15HB 150p "
ham,Will do. Was exhausted on train this morning. Too much wine and pie. You sleep well too
ham,No * am working on the ringing u thing but have whole houseful of screaming brats so * am pulling my hair out! Loving u
ham,No I don't have cancer. Moms making a big deal out of a regular checkup aka pap smear
ham,We're done...
spam,"Urgent Urgent! We have 800 FREE flights to Europe to give away, call B4 10th Sept & take a friend 4 FREE. Call now to claim on 09050000555. BA128NNFWFLY150ppm"
spam,Customer Loyalty Offer:The NEW Nokia6650 Mobile from ONLY å£10 at TXTAUCTION! Txt word: START to No: 81151 & get yours Now! 4T&Ctxt TC 150p/MTmsg
ham,Well at this right I'm gonna have to get up and check today's steam sales/pee so text me when you want me to come get you
spam,"Got what it takes 2 take part in the WRC Rally in Oz? U can with Lucozade Energy! Text RALLY LE to 61200 (25p), see packs or lucozade.co.uk/wrc & itcould be u!"
ham,Am only searching for good dual sim mobile pa.
ham,That sucks. I'll go over so u can do my hair. You'll do it free right?
ham,Be sure to check your yahoo email. We sent photos yesterday
spam,"Thank you, winner notified by sms. Good Luck! No future marketing reply STOP to 84122 customer services 08450542832"
spam,5p 4 alfie Moon's Children in need song on ur mob. Tell ur m8s. Txt Tone charity to 8007 for Nokias or Poly charity for polys: zed 08701417012 profit 2 charity.
spam,URGENT We are trying to contact you Last weekends draw shows u have won a å£1000 prize GUARANTEED Call 09064017295 Claim code K52 Valid 12hrs 150p pm
spam,Would you like to see my XXX pics they are so hot they were nearly banned in the uk!
ham,I went to project centre
spam,Please CALL 08712402972 immediately as there is an urgent message waiting for you
spam,Had your mobile 11mths ? Update for FREE to Oranges latest colour camera mobiles & unlimited weekend calls. Call Mobile Upd8 on freefone 08000839402 or 2StopTxt
spam,from www.Applausestore.com MonthlySubscription@50p/msg max6/month T&CsC web age16 2stop txt stop
spam,"Loan for any purpose å£500 - å£75,000. Homeowners + Tenants welcome. Have you been previously refused? We can still help. Call Free 0800 1956669 or text back 'help'"
ham,Or i go home first lar Ì_ wait 4 me lor.. I put down my stuff first..
spam,"URGENT! Your mobile No 07xxxxxxxxx won a å£2,000 bonus caller prize on 02/06/03! this is the 2nd attempt to reach YOU! call 09066362231 ASAP! BOX97N7QP, 150PPM"
ham,Oooh bed ridden ey? What are YOU thinking of?
ham,"Velly good, yes please!"
ham,Dai what this da.. Can i send my resume to this id.
ham,"&lt;#&gt; %of pple marry with their lovers... becz they hav gud undrstndng dat avoids problems. i sent dis 2 u, u wil get gud news on friday by d person you like. And tomorrow will be the best day of your life. Dont break this chain. If you break you will suffer. send this to  &lt;#&gt;  frnds in &lt;#&gt;  mins whn u read..."
ham,"Sorry, I'll call later in meeting"
spam,"Free entry to the gr8prizes wkly comp 4 a chance to win the latest Nokia 8800, PSP or å£250 cash every wk.TXT GREAT to 80878 http//www.gr8prizes.com 08715705022"
ham,Mm yes dear look how i am hugging you both. :-P
spam,"Sunshine Hols. To claim ur med holiday send a stamped self address envelope to Drinks on Us UK, PO Box 113, Bray, Wicklow, Eire. Quiz Starts Saturday! Unsub Stop"
ham,"Sorry, I'll call you  later. I am in meeting sir."
ham,"Yeah, we can probably swing by once my roommate finishes up with his girl"
spam,Santa calling! Would your little ones like a call from Santa Xmas Eve? Call 09077818151 to book you time. Calls1.50ppm last 3mins 30s T&C www.santacalling.com
ham,"Hello, my love! How goes that day ? I wish your well and fine babe and hope that you find some job prospects. I miss you, boytoy ... *a teasing kiss*"
spam,Free entry in 2 a wkly comp to win FA Cup final tkts 21st May 2005. Text FA to 87121 to receive entry question(std txt rate)T&C's apply 08452810075over18's
spam,we tried to contact you re your response to our offer of a new nokia fone and camcorder hit reply or call 08000930705 for delivery
ham,I'm putting it on now. It should be ready for  &lt;TIME&gt;
spam,"all the lastest from Stereophonics, Marley, Dizzee Racal, Libertines and The Strokes! Win Nookii games with Flirt!! Click TheMob WAP Bookmark or text WAP to 82468"
spam,"Congrats 2 mobile 3G Videophones R yours. call 09063458130 now! videochat wid ur mates, play java games, Dload polypH music, noline rentl. bx420. ip4. 5we. 150p"
spam,URGENT! Your Mobile number has been awarded with a å£2000 prize GUARANTEED. Call 09061790126 from land line. Claim 3030. Valid 12hrs only 150ppm
spam,"For ur chance to win a å£250 cash every wk TXT: ACTION to 80608. T's&C's www.movietrivia.tv custcare 08712405022, 1x150p/wk."
spam,"Urgent! call 09061749602 from Landline. Your complimentary 4* Tenerife Holiday or å£10,000 cash await collection SAE T&Cs BOX 528 HP20 1YF 150ppm 18+"
spam,Summers finally here! Fancy a chat or flirt with sexy singles in yr area? To get MATCHED up just reply SUMMER now. Free 2 Join. OptOut txt STOP Help08714742804
ham,Miles and smiles r made frm same letters but do u know d difference..? smile on ur face keeps me happy even though I am miles away from u.. :-)keep smiling.. Good nyt
spam,"You have been selected to stay in 1 of 250 top British hotels - FOR NOTHING! Holiday Worth å£350! To Claim, Call London 02072069400. Bx 526, SW73SS"
ham,I love u 2 babe! R u sure everything is alrite. Is he being an idiot? Txt bak girlie
spam,Hi its LUCY Hubby at meetins all day Fri & I will B alone at hotel U fancy cumin over? Pls leave msg 2day 09099726395 Lucy x Callså£1/minMobsmoreLKPOBOX177HP51FL
spam,25p 4 alfie Moon's Children in need song on ur mob. Tell ur m8s. Txt Tone charity to 8007 for Nokias or Poly charity for polys: zed 08701417012 profit 2 charity.
spam,"HOT LIVE FANTASIES call now 08707509020 Just 20p per min NTT Ltd, PO Box 1327 Croydon CR9 5WB 0870..k"
ham,Those ducking chinchillas
ham,"Probably, want to pick up more?"
spam,"Hi, the SEXYCHAT girls are waiting for you to text them. Text now for a great night chatting. send STOP to stop this service"
ham,Ok then i will come to ur home after half an hour
spam,"FreeMsg Hey there darling it's been 3 week's now and no word back! I'd like some fun you up for it still? Tb ok! XxX std chgs to send, å£1.50 to rcv"
spam,YOU ARE CHOSEN TO RECEIVE A å£350 AWARD! Pls call claim number 09066364311 to collect your award which you are selected to receive as a valued mobile customer.
ham,"Aight, you close by or still down around alex's place?"
spam,PRIVATE! Your 2004 Account Statement for 07742676969 shows 786 unredeemed Bonus Points. To claim call 08719180248 Identifier Code: 45239 Expires
ham,Good Morning my Dear........... Have a great &amp; successful day.
ham,Wow didn't think it was that common. I take it all back ur not a freak! Unless u chop it off:-)
ham,You've already got a flaky parent. It'snot supposed to be the child's job to support the parent...not until they're The Ride age anyway. I'm supposed to be there to support you. And now i've hurt you. unintentional. But hurt nonetheless.
spam,Urgent Ur å£500 guaranteed award is still unclaimed! Call 09066368327 NOW closingdate04/09/02 claimcode M39M51 å£1.50pmmorefrommobile2Bremoved-MobyPOBox734LS27YF
spam,Ur balance is now å£500. Ur next question is: Who sang 'Uptown Girl' in the 80's ? 2 answer txt ur ANSWER to 83600. Good luck!
ham,Moji just informed me that you saved our lives. Thanks.
spam,22 days to kick off! For Euro2004 U will be kept up to date with the latest news and results daily. To be removed send GET TXT STOP to 83222
spam,You won't believe it but it's true. It's Incredible Txts! Reply G now to learn truly amazing things that will blow your mind. From O2FWD only 18p/txt
ham,Yes I posted a couple of pics on fb. There's still snow outside too. I'm just waking up :)
ham,Moji i love you more than words. Have a rich day
ham,Ok lor Ì_ reaching then message me.
spam,"YOU VE WON! Your 4* Costa Del Sol Holiday or å£5000 await collection. Call 09050090044 Now toClaim. SAE, TC s, POBox334, Stockport, SK38xh, Costå£1.50/pm, Max10mins"
ham,Mystery solved! Just opened my email and he's sent me another batch! Isn't he a sweetie
spam,Moby Pub Quiz.Win a å£100 High Street prize if u know who the new Duchess of Cornwall will be? Txt her first name to 82277.unsub STOP å£1.50 008704050406 SP
