v1,v2
spam,Call Germany for only 1 pence per minute! Call from a fixed line via access number 0844 861 85 85. No prepayment. Direct access! www.telediscount.co.uk
ham,Hi da:)how is the todays class?
spam,PRIVATE! Your 2003 Account Statement for 07753741225 shows 800 un-redeemed S. I. M. points. Call 08715203677 Identifier Code: 42478 Expires 24/10/04
spam,FREE camera phones with linerental from 4.49/month with 750 cross ntwk mins. 1/2 price txt bundle deals also avble. Call 08001950382 or call2optout/J MF
spam,"Free msg. Sorry, a service you ordered from 81303 could not be delivered as you do not have sufficient credit. Please top up to receive the service."
ham,Hope this text meets you smiling. If not then let this text give you a reason to smile. Have a beautiful day.
ham,I am taking you for italian food. How about a pretty dress with no panties? :)
spam,Sunshine Quiz Wkly Q! Win a top Sony DVD player if u know which country Liverpool played in mid week? Txt ansr to 82277. å£1.50 SP:Tyrone
spam,December only! Had your mobile 11mths+? You are entitled to update to the latest colour camera mobile for Free! Call The Mobile Update Co FREE on 08002986906
ham,Dude while were makin those weirdy brownies my sister made awesome cookies. I took pics.
ham,Beauty sleep can help ur pimples too.
ham,Lol! Nah wasn't too bad thanks. Its good to b home but its been quite a reality check. Hows ur day been? Did u do anything with website?
spam,Ringtone Club: Gr8 new polys direct to your mobile every week !
ham,Ok c Ì_ then.
ham,Yes..he is really great..bhaji told kallis best cricketer after sachin in world:).very tough to get out.
spam,Camera - You are awarded a SiPix Digital Camera! call 09061221066 fromm landline. Delivery within 28 days.
ham,What happen dear tell me
spam,You have won a guaranteed å£200 award or even å£1000 cashto claim UR award call free on 08000407165 (18+) 2 stop getstop on 88222 PHP
ham,E admin building there? I might b slightly earlier... I'll call u when i'm reaching...
spam,Do you want a new Video handset? 750 any time any network mins? UNLIMITED TEXT? Camcorder? Reply or Call now 08000930705 for del Sat AM
ham,What i told before i tell. Stupid hear after i wont tell anything to you. You dad called to my brother and spoken. Not with me.
ham,Ooooooh I forgot to tell u I can get on yoville on my phone
ham,But am going to college pa. What to do. are else ill come there it self. Pa.
ham,* Am on a train back from northampton so i'm afraid not!
ham,Hey gorgeous man. My work mobile number is. Have a good one babe. Squishy Mwahs.
spam,"UpgrdCentre Orange customer, you may now claim your FREE CAMERA PHONE upgrade for your loyalty. Call now on 0207 153 9153. Offer ends 26th July. T&C's apply. Opt-out available"
spam,"Latest Nokia Mobile or iPOD MP3 Player +å£400 proze GUARANTEED! Reply with: WIN to 83355 now! Norcorp Ltd.å£1,50/Mtmsgrcvd18+"
spam,Text PASS to 69669 to collect your polyphonic ringtones. Normal gprs charges apply only. Enjoy your tones
spam,Not heard from U4 a while. Call me now am here all night with just my knickers on. Make me beg for it like U did last time 01223585236 XX Luv Nikiyu4.net
spam,Urgent Please call 09066612661 from landline. å£5000 cash or a luxury 4* Canary Islands Holiday await collection. T&Cs SAE award. 20M12AQ. 150ppm. 16+ ‰ÛÏ
ham,Pandy joined 4w technologies today.he got job..
ham,"Save yourself the stress. If the person has a dorm account, just send your account details and the money will be sent to you."
spam,Ur TONEXS subscription has been renewed and you have been charged å£4.50. You can choose 10 more polys this month. www.clubzed.co.uk *BILLING MSG*
spam,IMPORTANT MESSAGE. This is a final contact attempt. You have important messages waiting out our customer claims dept. Expires 13/4/04. Call 08717507382 NOW!
ham,Oh:)as usual vijay film or its different?
ham,Hi dear we saw dear. We both are happy. Where you my battery is low
ham,Meet after lunch la...
spam,74355 XMAS iscoming & ur awarded either å£500 CD gift vouchers & free entry 2 r å£100 weekly draw txt MUSIC to 87066 TnC
ham,I cant pick the phone right now. Pls send a message
spam,"Sunshine Hols. To claim ur med holiday send a stamped self address envelope to Drinks on Us UK, PO Box 113, Bray, Wicklow, Eire. Quiz Starts Saturday! Unsub Stop"
ham,K...k...when will you give treat?
ham,"Found it, ENC  &lt;#&gt; , where you at?"
spam,"cmon babe, make me horny, *turn* me on! Txt me your fantasy now babe -) Im hot, sticky and need you now. All replies cost å£1.50. 2 cancel send STOP"
spam,Please call our customer service representative on FREEPHONE 0808 145 4742 between 9am-11pm as you have WON a guaranteed å£1000 cash or å£5000 prize!
spam,"Double mins and txts 4 6months FREE Bluetooth on Orange. Available on Sony, Nokia Motorola phones. Call MobileUpd8 on 08000839402 or call2optout/N9DX"
ham,Yup i'm still having coffee wif my frens... My fren drove she'll give me a lift...
ham,Okie but i scared u say i fat... Then u dun wan me already...
spam,Congratulations ur awarded either a yrs supply of CDs from Virgin Records or a Mystery Gift GUARANTEED Call 09061104283 Ts&Cs www.smsco.net å£1.50pm approx 3mins
spam,GSOH? Good with SPAM the ladies?U could b a male gigolo? 2 join the uk's fastest growing mens club reply ONCALL. mjzgroup. 08714342399.2stop reply STOP. msg@å£1.50rcvd
ham,somewhere out there beneath the pale moon light someone think in of u some where out there where dreams come true... goodnite &amp; sweet dreams
spam,"09066362231 URGENT! Your mobile No 07xxxxxxxxx won a å£2,000 bonus caller prize on 02/06/03! this is the 2nd attempt to reach YOU! call 09066362231 ASAP!"
ham,Pls speak with me. I wont ask anything other then you friendship.
ham,Am i that much dirty fellow?
ham,I only haf msn. It's yijue@hotmail.com
ham,Yup he msg me: is tat yijue? Then i tot it's my group mate cos we meeting today mah... I'm askin if Ì_ leaving earlier or wat mah cos mayb Ì_ haf to walk v far...
spam,FREE for 1st week! No1 Nokia tone 4 ur mob every week just txt NOKIA to 8007 Get txting and tell ur mates www.getzed.co.uk POBox 36504 W45WQ norm150p/tone 16+
spam,December only! Had your mobile 11mths+? You are entitled to update to the latest colour camera mobile for Free! Call The Mobile Update Co FREE on 08002986906
spam,"As a SIM subscriber, you are selected to receive a Bonus! Get it delivered to your door, Txt the word OK to No: 88600 to claim. 150p/msg, EXP. 30Apr"
ham,"Cant believe i said so many things to you this morning when all i really wanted to say was good morning, i love you! Have a beautiful morning. See you in the library later."
spam,WIN a year supply of CDs 4 a store of ur choice worth å£500 & enter our å£100 Weekly draw txt MUSIC to 87066 Ts&Cs www.Ldew.com.subs16+1win150ppmx3
spam,YOU HAVE WON! As a valued Vodafone customer our computer has picked YOU to win a å£150 prize. To collect is easy. Just call 09061743386
ham,U're welcome... Caught u using broken english again...
ham,Glad it went well :) come over at 11 then we'll have plenty of time before claire goes to work.
spam,"ou are guaranteed the latest Nokia Phone, a 40GB iPod MP3 player or a å£500 prize! Txt word: COLLECT to No: 83355! IBHltd LdnW15H 150p/Mtmsgrcvd18"
ham,One small prestige problem now.
ham,I have had two more letters from . I will copy them for you cos one has a message for you. Speak soon
ham,Can. Dunno wat to get 4 her...
spam,Congratulations ur awarded 500 of CD vouchers or 125gift guaranteed & Free entry 2 100 wkly draw txt MUSIC to 87066 TnCs www.Ldew.com1win150ppmx3age16
ham,Oh ok i didnt know what you meant. Yep i am baby jontin
ham,"I'm nt goin, got somethin on, unless they meetin 4 dinner lor... Haha, i wonder who will go tis time..."
ham,I will see in half an hour
spam,"You are a å£1000 winner or Guaranteed Caller Prize, this is our Final attempt to contact you! To Claim Call 09071517866 Now! 150ppmPOBox10183BhamB64XE"
spam,"Shop till u Drop, IS IT YOU, either 10K, 5K, å£500 Cash or å£100 Travel voucher, Call now, 09064011000. NTT PO Box CR01327BT fixedline Cost 150ppm mobile vary"
ham,Oh... Lk tt den we take e one tt ends at cine lor... Dun wan yogasana oso can...
ham,Nope but i'll b going 2 sch on fri quite early lor cos mys sis got paper in da morn :-)
spam,Sex up ur mobile with a FREE sexy pic of Jordan! Just text BABE to 88600. Then every wk get a sexy celeb! PocketBabe.co.uk 4 more pics. 16 å£3/wk 087016248
spam,"Urgent UR awarded a complimentary trip to EuroDisinc Trav, Aco&Entry41 Or å£1000. To claim txt DIS to 87121 18+6*å£1.50(moreFrmMob. ShrAcomOrSglSuplt)10, LS1 3AJ"
ham,"Sorry that took so long, omw now"
spam,Text BANNEDUK to 89555 to see! cost 150p textoperator g696ga 18+ XXX
ham,Bbq this sat at mine from 6ish. Ur welcome 2 come
ham,Goodnight da thangam I really miss u dear.
ham,Anything lor if they all go then i go lor...
ham,Don't make life too stressfull.. Always find time to Laugh.. It may not add years to your Life! But surely adds more life to ur years!! Gud ni8..swt dreams..
ham,I asked sen to come chennai and search for job.
spam,"U can WIN å£100 of Music Gift Vouchers every week starting NOW Txt the word DRAW to 87066 TsCs www.Idew.com SkillGame, 1Winaweek, age16. 150ppermessSubscription"
spam,We tried to call you re your reply to our sms for a video mobile 750 mins UNLIMITED TEXT free camcorder Reply or call now 08000930705 Del Thurs
ham,Da is good good player.why he is unsold.
ham,Are you ok. What happen to behave like this
spam,Want 2 get laid tonight? Want real Dogging locations sent direct 2 ur Mob? Join the UK's largest Dogging Network by txting MOAN to 69888Nyt. ec2a. 31p.msg@150p
ham,hows my favourite person today? r u workin hard? couldn't sleep again last nite nearly rang u at 4.30
ham,K...k:)why cant you come here and search job:)
spam,"0A$NETWORKS allow companies to bill for SMS, so they are responsible for their \suppliers\"""""
spam,<Forwarded from 88877>FREE entry into our å£250 weekly comp just send the word ENTER to 88877 NOW. 18 T&C www.textcomp.com
ham,Yo do you know anyone  &lt;#&gt;  or otherwise able to buy liquor? Our guy flaked and right now if we don't get a hold of somebody its just 4 loko all night
spam,Ur cash-balance is currently 500 pounds - to maximize ur cash-in now send CASH to 86688 only 150p/msg. CC: 08708800282 HG/Suite342/2Lands Row/W1J6HL
ham,Fyi I'm gonna call you sporadically starting at like  &lt;#&gt;  bc we are not not doin this shit
spam,"XXXMobileMovieClub: To use your credit, click the WAP link in the next txt message or click here>> http://wap. xxxmobilemovieclub.com?n=QJKGIGHJJGCBL"
ham,Oh dang! I didn't mean o send that to you! Lol!
ham,Nope. Meanwhile she talk say make i greet you.
ham,"Cool, I'll text you when I'm on the way"
spam,Our brand new mobile music service is now live. The free music player will arrive shortly. Just install on your phone to browse content from the top artists.
spam,"SMS. ac JSco: Energy is high, but u may not know where 2channel it. 2day ur leadership skills r strong. Psychic? Reply ANS w/question. End? Reply END JSCO"
ham,Yeah. I got a list with only u and Joanna if I'm feeling really anti social
spam,GENT! We are trying to contact you. Last weekends draw shows that you won a å£1000 prize GUARANTEED. Call 09064012160. Claim Code K52. Valid 12hrs only. 150ppm
spam,Dear 0776xxxxxxx U've been invited to XCHAT. This is our final attempt to contact u! Txt CHAT to 86688 150p/MsgrcvdHG/Suite342/2Lands/Row/W1J6HL LDN 18yrs
ham,Back in brum! Thanks for putting us up and keeping us all and happy. See you soon
ham,I think if he rule tamilnadu..then its very tough for our people.
spam,Dorothy@kiefer.com (Bank of Granite issues Strong-Buy) EXPLOSIVE PICK FOR OUR MEMBERS *****UP OVER 300% *********** Nasdaq Symbol CDGT That is a $5.00 per..
spam,U have a secret admirer. REVEAL who thinks U R So special. Call 09065174042. To opt out Reply REVEAL STOP. 1.50 per msg recd. Cust care 07821230901
spam,Urgent! Please call 09061743811 from landline. Your ABTA complimentary 4* Tenerife Holiday or å£5000 cash await collection SAE T&Cs Box 326 CW25WX 150ppm
spam,"January Male Sale! Hot Gay chat now cheaper, call 08709222922. National rate from 1.5p/min cheap to 7.8p/min peak! To stop texts call 08712460324 (10p/min)"
spam,URGENT! Your Mobile number has been awarded with a å£2000 Bonus Caller Prize. Call 09058095201 from land line. Valid 12hrs only
spam,Text & meet someone sexy today. U can find a date or even flirt its up to U. Join 4 just 10p. REPLY with NAME & AGE eg Sam 25. 18 -msg recd@thirtyeight pence
spam,Please call Amanda with regard to renewing or upgrading your current T-Mobile handset free of charge. Offer ends today. Tel 0845 021 3680 subject to T's and C's
ham,Okie
spam,Do you want a New Nokia 3510i colour phone DeliveredTomorrow? With 300 free minutes to any mobile + 100 free texts + Free Camcorder reply or call 08000930705
spam,Double Mins & Double Txt & 1/2 price Linerental on Latest Orange Bluetooth mobiles. Call MobileUpd8 for the very latest offers. 08000839402 or call2optout/LF56
ham,Just normal only here :)
ham,Ya very nice. . .be ready on thursday
spam,SMS SERVICES For your inclusive text credits pls gotto www.comuk.net login 3qxj9 unsubscribe with STOP no extra charge help 08702840625 comuk.220cm2 9AE
spam,Sorry I missed your call let's talk when you have the time. I'm on 07090201529
ham,Y so late but i need to go n get da laptop...
ham,Can u look 4 me in da lib i got stuff havent finish yet.
ham,Great comedy..cant stop laughing da:)
spam,You are a winner U have been specially selected 2 receive å£1000 cash or a 4* holiday (flights inc) speak to a live operator 2 claim 0871277810810
ham,I can make lasagna for you... vodka...
ham,Kothi print out marandratha.
spam,"our mobile number has won å£5000, to claim calls us back or ring the claims hot line on 09050005321."
ham,"Yeah, in fact he just asked if we needed anything like an hour ago. When and how much?"
spam,EASTENDERS TV Quiz. What FLOWER does DOT compare herself to? D= VIOLET E= TULIP F= LILY txt D E or F to 84025 NOW 4 chance 2 WIN å£100 Cash WKENT/150P16+
ham,Guess which pub im in? Im as happy as a pig in clover or whatever the saying is!
spam,"5 Free Top Polyphonic Tones call 087018728737, National Rate. Get a toppoly tune sent every week, just text SUBPOLY to 81618, å£3 per pole. UnSub 08718727870."
ham,Nite nite pocay wocay luv u more than n e thing 4eva I promise ring u 2morrowxxxx
ham,I like dis sweater fr mango but no more my size already so irritating.
ham,Do u noe wat time e place dat sells 4d closes?
ham,Great. P diddy is my neighbor and comes for toothpaste every morning
ham,"Good FRIENDS CaRE for each Other.. CLoSE Friends UNDERSTaND each Other... and TRUE Friends STaY forever beyond words, beyond time. Gud ni8"
ham,", ,  and  picking them up from various points | going 2 yeovil | and they will do the motor project 4 3 hours | and then u take them home. || 12 2 5.30 max. || Very easy"
spam,tells u 2 call 09066358152 to claim å£5000 prize. U have 2 enter all ur mobile & personal details @ the prompts. Careful!
ham,says the  &lt;#&gt;  year old with a man and money. I'm down to my last  &lt;#&gt; . Still waiting for that check.
spam,SplashMobile: Choose from 1000s of gr8 tones each wk! This is a subscrition service with weekly tones costing 300p. U have one credit - kick back and ENJOY
spam,PRIVATE! Your 2003 Account Statement for shows 800 un-redeemed S. I. M. points. Call 08715203652 Identifier Code: 42810 Expires 29/10/0
ham,Can i get your opinion on something first?
ham,"Do you know why god created gap between your fingers..? So that, One who is made for you comes &amp; fills those gaps by holding your hand with LOVE..!"
spam,New TEXTBUDDY Chat 2 horny guys in ur area 4 just 25p Free 2 receive Search postcode or at gaytextbuddy.com. TXT ONE name to 89693. 08715500022 rpl Stop 2 cnl
ham,Im good! I have been thinking about you...
spam,Call FREEPHONE 0800 542 0578 now!
ham,Wow v v impressed. Have funs shopping!
ham,Got smaller capacity one? Quite ex...
spam,Ur cash-balance is currently 500 pounds - to maximize ur cash-in now send GO to 86688 only 150p/meg. CC: 08718720201 HG/Suite342/2lands Row/W1j6HL
spam,U have a secret admirer who is looking 2 make contact with U-find out who they R*reveal who thinks UR so special-call on 09058094599
spam,Todays Voda numbers ending 5226 are selected to receive a ?350 award. If you hava a match please call 08712300220 quoting claim code 1131 standard rates app
ham,I‰Û÷ll have a look at the frying pan in case it‰Û÷s cheap or a book perhaps. No that‰Û÷s silly a frying pan isn‰Û÷t likely to be a book
spam,"TheMob>Hit the link to get a premium Pink Panther game, the new no. 1 from Sugababes, a crazy Zebra animation or a badass Hoody wallpaper-all 4 FREE!"
spam,Married local women looking for discreet action now! 5 real matches instantly to your phone. Text MATCH to 69969 Msg cost 150p 2 stop txt stop BCMSFWC1N3XX
spam,"WELL DONE! Your 4* Costa Del Sol Holiday or å£5000 await collection. Call 09050090044 Now toClaim. SAE, TCs, POBox334, Stockport, SK38xh, Costå£1.50/pm, Max10mins"
ham,"Aight I'll grab something to eat too, text me when you're back at mu"
ham,Ok then no need to tell me anything i am going to sleep good night
ham,Annoying isn't it.
ham,Smith waste da.i wanna gayle.
spam,Free Top ringtone -sub to weekly ringtone-get 1st week free-send SUBPOLY to 81618-?3 per week-stop sms-08718727870
spam,"SMSSERVICES. for yourinclusive text credits, pls goto www.comuk.net login= 3qxj9 unsubscribe with STOP, no extra charge. help 08702840625.COMUK. 220-CM2 9AE"
spam,Want explicit SEX in 30 secs? Ring 02073162414 now! Costs 20p/min
spam,"I want some cock! My hubby's away, I need a real man 2 satisfy me. Txt WIFE to 89938 for no strings action. (Txt STOP 2 end, txt rec å£1.50ea. OTBox 731 LA1 7WS. )"
spam,"URGENT!! Your 4* Costa Del Sol Holiday or å£5000 await collection. Call 09050090044 Now toClaim. SAE, TC s, POBox334, Stockport, SK38xh, Costå£1.50/pm, Max10mins"
ham,I'm always on yahoo messenger now. Just send the message to me and i.ll get it you may have to send it in the mobile mode sha but i.ll get it. And will reply.
ham,Amazing : If you rearrange these letters it gives the same meaning... Dormitory = Dirty room Astronomer = Moon starer The eyes = They see Election results = Lies lets recount Mother-in-law = Woman Hitler Eleven plus two =Twelve plus one Its Amazing... !:-)
spam,"We know someone who you know that fancies you. Call 09058097218 to find out who. POBox 6, LS15HB 150p"
spam,Do you want a New Nokia 3510i Colour Phone Delivered Tomorrow? With 200 FREE minutes to any mobile + 100 FREE text + FREE camcorder Reply or Call 8000930705
spam,"BangBabes Ur order is on the way. U SHOULD receive a Service Msg 2 download UR content. If U do not, GoTo wap. bangb. tv on UR mobile internet/service menu"
ham,K.:)you are the only girl waiting in reception ah?
ham,Ugh. Gotta drive back to sd from la. My butt is sore.
ham,"Wen ur lovable bcums angry wid u, dnt take it seriously.. Coz being angry is d most childish n true way of showing deep affection, care n luv!.. kettoda manda... Have nice day da."
ham,Normally i use to drink more water daily:)
ham,His frens go then he in lor. Not alone wif my mum n sis lor.
ham,"Night night, see you tomorrow"
ham,2 and half years i missed your friendship:-)
ham,Its not the same here. Still looking for a job. How much do Ta's earn there.
ham,"Sorry im getting up now, feel really bad- totally rejected that kinda me thing."
ham,K:)all the best:)congrats...
spam,We have new local dates in your area - Lots of new people registered in YOUR AREA. Reply DATE to start now! 18 only www.flirtparty.us REPLYS150
ham,&lt;DECIMAL&gt; m but its not a common car here so its better to buy from china or asia. Or if i find it less expensive. I.ll holla
spam,December only! Had your mobile 11mths+? You are entitled to update to the latest colour camera mobile for Free! Call The Mobile Update Co FREE on 08002986906
spam,"Ur balance is now å£600. Next question: Complete the landmark, Big, A. Bob, B. Barry or C. Ben ?. Text A, B or C to 83738. Good luck!"
ham,Friendship poem: Dear O Dear U R Not Near But I Can Hear Dont Get Fear Live With Cheer No More Tear U R Always my Dear. Gud ni8
ham,Usually the body takes care of it buy making sure it doesnt progress. Can we pls continue this talk on saturday.
spam,"FREE MESSAGE Activate your 500 FREE Text Messages by replying to this message with the word FREE For terms & conditions, visit www.07781482378.com"
spam,PRIVATE! Your 2003 Account Statement for 07973788240 shows 800 un-redeemed S. I. M. points. Call 08715203649 Identifier Code: 40533 Expires 31/10/04
ham,Send me your resume:-)
ham,We confirm eating at esplanade?
ham,Nope... C Ì_ then...
ham,I just saw ron burgundy captaining a party boat so yeah
ham,I am getting threats from your sales executive Shifad as i raised complaint against him. Its an official message.
spam,thesmszone.com lets you send free anonymous and masked messages..im sending this message from there..do you see the potential for abuse???
ham,"OH MR SHEFFIELD! You wanna play THAT game, okay. You're the boss and I'm the nanny. You give me a raise and I'll give YOU one!!"
spam,"Claim a 200 shopping spree, just call 08717895698 now! Have you won! MobStoreQuiz10ppm"
spam,Ringtone Club: Get the UK singles chart on your mobile each week and choose any top quality ringtone! This message is free of charge.
spam,A link to your picture has been sent. You can also use http://alto18.co.uk/wave/wave.asp?o=44345
ham,Good afternoon starshine! How's my boytoy? Does he crave me yet? Ache to fuck me ? *sips cappuccino* I miss you babe *teasing kiss*
spam,PRIVATE! Your 2003 Account Statement for shows 800 un-redeemed S.I.M. points. Call 08718738001 Identifier Code: 49557 Expires 26/11/04
ham,"I've got  &lt;#&gt; , any way I could pick up?"
spam,Buy Space Invaders 4 a chance 2 win orig Arcade Game console. Press 0 for Games Arcade (std WAP charge) See o2.co.uk/games 4 Terms + settings. No purchase
ham,Ok. She'll be ok. I guess
ham,Can you open the door?
spam,You are a winner U have been specially selected 2 receive å£1000 cash or a 4* holiday (flights inc) speak to a live operator 2 claim 0871277810810
ham,Boo what time u get out? U were supposed to take me shopping today. :(
spam,"You are being contacted by our Dating Service by someone you know! To find out who it is, call from your mobile or landline 09064017305 PoBox75LDNS7 "
ham,Yeah sure I'll leave in a min
spam,Want a new Video Phone? 750 anytime any network mins? Half price line rental free text for 3 months? Reply or call 08000930705 for free delivery
ham,"Thats a bit weird, even ?- where is the do supposed to be happening? But good idea, sure they will be in pub!"
ham,CERI U REBEL! SWEET DREAMZ ME LITTLE BUDDY!! C YA 2MORO! WHO NEEDS BLOKES
ham,"(And my man carlos is definitely coming by mu tonight, no excuses)"
ham,And miss vday the parachute and double coins??? U must not know me very well...
spam,December only! Had your mobile 11mths+? You are entitled to update to the latest colour camera mobile for Free! Call The Mobile Update VCo FREE on 08002986906
spam,No. 1 Nokia Tone 4 ur mob every week! Just txt NOK to 87021. 1st Tone FREE ! so get txtin now and tell ur friends. 150p/tone. 16 reply HL 4info
ham,"Sorry, I'll call later"
spam,Your next amazing xxx PICSFREE1 video will be sent to you enjoy! If one vid is not enough for 2day text back the keyword PICSFREE1 to get the next video.
ham,I dont have i shall buy one dear
spam,Dear U've been invited to XCHAT. This is our final attempt to contact u! Txt CHAT to 86688
ham,What year. And how many miles.
spam,Please CALL 08712402578 immediately as there is an urgent message waiting for you
spam,Someonone you know is trying to contact you via our dating service! To find out who it could be call from your mobile or landline 09064015307 BOX334SK38ch
spam,Call Germany for only 1 pence per minute! Call from a fixed line via access number 0844 861 85 85. No prepayment. Direct access!
spam,"Spook up your mob with a Halloween collection of a logo & pic message plus a free eerie tone, txt CARD SPOOK to 8007 zed 08701417012150p per logo/pic "
ham,Senthil group company Apnt 5pm.
